rule_id,rule_name,rule_category,applicable_products,rule_content,effective_date,source
RULE001,基金交易结算规定,交易,所有产品,基金交易应当遵循T+1结算原则，特殊情况需报备,2020-01-01,证监会
RULE002,基金估值业务指引,估值,所有产品,基金估值应当采用公允价值计量，确保估值的准确性和及时性,2020-01-01,基金业协会
RULE003,货币市场基金估值规定,估值,货币型,货币市场基金可采用摊余成本法进行估值,2020-01-01,证监会
RULE004,基金信息披露管理办法,披露,所有产品,基金应当按照规定及时、准确、完整地披露信息,2020-01-01,证监会
RULE005,QDII基金投资管理规定,交易,QDII,QDII基金投资境外市场应当遵守外汇管理规定,2020-01-01,证监会
RULE006,基金托管业务管理办法,合规,所有产品,基金托管人应当履行安全保管、资金清算、会计复核等职责,2020-01-01,证监会
RULE007,基金风险管理指引,风控,所有产品,基金管理人应当建立健全风险管理体系,2020-01-01,基金业协会
RULE008,基金清算业务规范,清算,所有产品,基金清算应当确保数据准确、流程规范、时效性强,2020-01-01,基金业协会
